metus aenean,orci vehicula condimentum curabitur in libero ut massa volutpat convallis morbi odio odio elementum eu interdum eu
quis lectus,libero nullam sit amet turpis elementum ligula vehicula consequat morbi a ipsum integer a nibh in quis justo maecenas rhoncus aliquam lacus
turpis nec,in ante vestibulum ante ipsum primis in faucibus orci luctus et ultrices posuere
sed augue,id ligula suspendisse ornare consequat lectus in est
lacinia sapien,placerat praesent blandit nam nulla integer pede justo lacinia eget tincidunt eget tempus vel pede morbi porttitor lorem id ligula suspendisse ornare consequat lectus in est risus auctor sed tristique
aenean sit,eget eros elementum pellentesque quisque porta volutpat erat quisque erat eros viverra eget congue eget semper rutrum nulla nunc purus phasellus in felis donec semper sapien a
erat quisque,nibh fusce lacus purus aliquet at feugiat non pretium quis lectus suspendisse potenti in eleifend quam a odio in hac habitasse platea dictumst maecenas ut massa quis augue luctus
rhoncus dui,elementum eu interdum eu tincidunt in leo maecenas pulvinar lobortis est phasellus sit
faucibus orci,eu mi nulla ac enim in tempor turpis nec euismod scelerisque quam turpis adipiscing lorem vitae mattis
nec sem,sit amet sapien dignissim vestibulum vestibulum ante ipsum primis in faucibus orci luctus
in porttitor,in faucibus orci luctus et ultrices posuere cubilia curae duis faucibus accumsan odio curabitur convallis duis
libero quis,porttitor lacus at turpis donec posuere metus vitae ipsum aliquam non mauris morbi non lectus aliquam sit amet diam
sapien arcu,curae duis faucibus accumsan odio curabitur convallis duis consequat dui nec nisi volutpat eleifend donec ut dolor morbi
lacinia eget,bibendum felis sed interdum venenatis turpis enim blandit mi
eget massa,nullam molestie nibh in lectus pellentesque at nulla suspendisse
ac nibh,enim in tempor turpis nec euismod scelerisque quam turpis adipiscing lorem vitae mattis nibh ligula nec sem duis aliquam convallis
vestibulum aliquet,lectus vestibulum quam sapien varius ut blandit non interdum in ante vestibulum ante ipsum primis in
nam nulla,blandit mi in porttitor pede justo eu massa
id massa,pede ullamcorper augue a suscipit nulla elit ac nulla sed vel enim sit amet nunc viverra dapibus nulla suscipit ligula in lacus curabitur at ipsum ac tellus semper interdum mauris
curabitur in,amet turpis elementum ligula vehicula consequat morbi a ipsum
